{
  "url": "https://www.gov.uk/guidance/get-help-for-your-inactive-or-ineffective-charity",
  "public_updated_at": "2024-07-01T12:00:00Z",
  "attribution": "Source: GOV.UK, Charity Commission guidance, OGL v3.0",
  "disclaimer": "This guidance is not legal advice.",
  "content_id": "2cd95b28-c7fd-415a-b710-f85386feb4df",
  "content": {
    "base_path": "/guidance/get-help-for-your-inactive-or-ineffective-charity",
    "document_type": "guidance",
    "title": "Get help for your inactive or ineffective charity",
    "details": {
      "body": ["...trimmed..."],
      "first_published_at": "2022-04-27T00:00:00Z"
    }
  }
}
